url,id,title
https://stackoverflow.com/questions/75220070,75220070,Pytorch convolutional Autoencoder
https://stackoverflow.com/questions/75218609,75218609,Validation acc is very high in each fold but Test acc is very low
https://stackoverflow.com/questions/74552312,74552312,NaN loss in fit parametrs
https://stackoverflow.com/questions/74093824,74093824,How to implement a simple neural network using keras
https://stackoverflow.com/questions/73909006,73909006,How to implement a given model to Keras?
https://stackoverflow.com/questions/73780627,73780627,Neural network low accuracy
https://stackoverflow.com/questions/73762984,73762984,Masking in LSTM with variable length input does not work
https://stackoverflow.com/questions/73674570,73674570,Tensorflow model returning insane loss values
https://stackoverflow.com/questions/73589496,73589496,Why is the validation accuracy fluctuating in every epoch?
https://stackoverflow.com/questions/73410090,73410090,Very low validation accuracy but high training accuracy
https://stackoverflow.com/questions/73406385,73406385,simple Neural Network gives random prediction result
https://stackoverflow.com/questions/73009464,73009464,My tensorflow/keras CNN does not improve over epochs
https://stackoverflow.com/questions/73001179,73001179,Tensorflow model is predicting two values instead of one
https://stackoverflow.com/questions/72994736,72994736,Cannot verify manually the calculations by tf.keras.losses.BinaryCrossentropy
https://stackoverflow.com/questions/72901551,72901551,Invalid Argument Error: Graph Execution Error on Tensorflow NN
https://stackoverflow.com/questions/72874743,72874743,Training a keras based network from scratch on Tensorflow
https://stackoverflow.com/questions/72759580,72759580,Loss returns nan in tensorflow
https://stackoverflow.com/questions/72753295,72753295,Accuracy is not increasing in images classification when using TensorFlow model
https://stackoverflow.com/questions/72709632,72709632,"Keras Loss is Negative (Binary CrossEntropy, double output model)"
https://stackoverflow.com/questions/72632411,72632411,Keras producing error while working with ImageDataGenerator
https://stackoverflow.com/questions/72539378,72539378,How to solve Graph execution error during my model training?
https://stackoverflow.com/questions/72437881,72437881,Stateful RNN (LSTM) in keras
https://stackoverflow.com/questions/72362319,72362319,How to fix cardinality error in my CNN model
https://stackoverflow.com/questions/72118367,72118367,Tensorflow: InvalidArgumentError: Graph execution error:
https://stackoverflow.com/questions/72038257,72038257,Keras Sequential model gives less accuracy than Functional Model though being same
https://stackoverflow.com/questions/71950668,71950668,CNN predicting negative values
https://stackoverflow.com/questions/71799046,71799046,model.fit gives InvalidArgumentError: Graph execution error:
https://stackoverflow.com/questions/71764359,71764359,How can I fix this problem related to Conv2D of Keras?
https://stackoverflow.com/questions/71764294,71764294,Invalid Argument Error: Graph Execution Error
https://stackoverflow.com/questions/71755080,71755080,Why do I have extremely low loss but accuracy is 0?
https://stackoverflow.com/questions/71745320,71745320,WHY tf.keras.layers.Conv2D gives different results at each run
https://stackoverflow.com/questions/71493889,71493889,how can reslove : InvalidArgumentError: Graph execution error?
https://stackoverflow.com/questions/71479172,71479172,LSTM Regression issues with masking and intuition (keras)
https://stackoverflow.com/questions/71357014,71357014,Running a fine-tune model for my CNN : Value Error
https://stackoverflow.com/questions/71300786,71300786,TensorFlow Probability - want NN to output multiple distributions
https://stackoverflow.com/questions/71255139,71255139,How to fit a keras model with a dataset?
https://stackoverflow.com/questions/71153492,71153492,Invalid Argument Error / Graph Execution Error
https://stackoverflow.com/questions/71083471,71083471,How Can I Increase My CNN Model's Accuracy
https://stackoverflow.com/questions/70781692,70781692,How to make a CNN model correctly?
https://stackoverflow.com/questions/70734861,70734861,Evaluation of keras model returns loss:0 and accuracy:0
https://stackoverflow.com/questions/70642220,70642220,Very strange keras behaviour - Better loss with an error in the code
https://stackoverflow.com/questions/70640156,70640156,Wrong predictions with own mnist-like images
https://stackoverflow.com/questions/70639788,70639788,Why My Deep Learning Model is not changing neither its loss nor its accuracy
https://stackoverflow.com/questions/70585705,70585705,ValueError when fitting keras model
https://stackoverflow.com/questions/70378719,70378719,Why does an ANN validation accuracy oscillate?
https://stackoverflow.com/questions/70315112,70315112,Keras image classification val_accuracy doesn't improve
https://stackoverflow.com/questions/70194443,70194443,Simple Neural Network
https://stackoverflow.com/questions/70101855,70101855,TensorFlow: ValueError: Shapes are incompatible
https://stackoverflow.com/questions/69990800,69990800,Why is TensorFlow model reporting incorrect high confidence level for predictions?
https://stackoverflow.com/questions/69977877,69977877,Loss function has negative values
https://stackoverflow.com/questions/69826600,69826600,LSTM with multiple input features and multiple outputs
https://stackoverflow.com/questions/69755379,69755379,Why is my loss function increasing with each epoch?
https://stackoverflow.com/questions/69750470,69750470,Shapes mismatch in Tensorflow model
https://stackoverflow.com/questions/69436647,69436647,Training Accuracy Stuck at 0.50+-
https://stackoverflow.com/questions/69191418,69191418,Tensorflow Model prediction output is always [0. 1.]
https://stackoverflow.com/questions/69144854,69144854,Why is my Model's performance plateauing?
https://stackoverflow.com/questions/68992377,68992377,Conv2D lost a dimension from tensor. resulting in incompatible dimension error
https://stackoverflow.com/questions/68947291,68947291,TensorFlow False Detection
https://stackoverflow.com/questions/68809470,68809470,Kaggle Titanic-Machine Learning From Disaster with TensorFlow: Model Training unable to get loss values
https://stackoverflow.com/questions/68692047,68692047,Why accuracy stays zero in Keras LSTM while other metrics improve when training?
https://stackoverflow.com/questions/68607955,68607955,Methods for increasing accuracying of a CNN for image classification
https://stackoverflow.com/questions/68533626,68533626,Keras LSTM: predict multiple sequences from single input array
https://stackoverflow.com/questions/68445134,68445134,Predicting single image using Tensorflow not being accurate
https://stackoverflow.com/questions/68323793,68323793,Keras LSTM input ValueError: Shapes are incompatible
https://stackoverflow.com/questions/68287769,68287769,Keras setting up dataset
https://stackoverflow.com/questions/68137562,68137562,accuracy for 1D CNN model is very low
https://stackoverflow.com/questions/68111196,68111196,Predicting the square root of a number using Machine Learning
https://stackoverflow.com/questions/68087196,68087196,Optimising Keras CNN
https://stackoverflow.com/questions/68085834,68085834,TensorFlow image classification loss doesn't decrease
https://stackoverflow.com/questions/68068140,68068140,3D CNN model throwing a Negative dimension error-- dimension issue
https://stackoverflow.com/questions/68061611,68061611,"LSTM occurs ValueError: Shapes (5, 2, 3) and (5, 3) are incompatible"
https://stackoverflow.com/questions/68040169,68040169,Testing Keras Sequential Neural Network - predictions totally inaccurate
https://stackoverflow.com/questions/67971122,67971122,Deep learning CNN network for CIFAR10 and FMNIST
https://stackoverflow.com/questions/67951244,67951244,Model.evaluate returns 0 loss when using custom model
https://stackoverflow.com/questions/67907000,67907000,Tensorflow masked loss function wrong inputs
https://stackoverflow.com/questions/67723770,67723770,TensorFlow functional too slow
https://stackoverflow.com/questions/67654494,67654494,cnn model for binary classification always returning 1
https://stackoverflow.com/questions/67643800,67643800,MLPclassifier from sklearn shows different accuracies when executed on other machine?
https://stackoverflow.com/questions/67615051,67615051,Implementing Binary Cross Entropy loss gives different answer than Tensorflow's
https://stackoverflow.com/questions/67517895,67517895,Accuracy too low with very simple CNN model using Keras in Tensorflow
https://stackoverflow.com/questions/67460062,67460062,Neural Network and Binary classification Guidance
https://stackoverflow.com/questions/67396593,67396593,Keras accuracy not increasing
https://stackoverflow.com/questions/67380042,67380042,Multi class image classification using CNN
https://stackoverflow.com/questions/67316256,67316256,Why do I get different predictions using Keras sequential neural network in a loop?
https://stackoverflow.com/questions/67291205,67291205,cnn model for binary classification with 86% val_accuracy always returning 1
https://stackoverflow.com/questions/67202347,67202347,I can't understand LSTM's prediction output
https://stackoverflow.com/questions/67158990,67158990,"Received a label value of 17 which is outside the valid range of [0, 12) - Keras Python"
https://stackoverflow.com/questions/67071953,67071953,Incompatible Shapes Keras NN
https://stackoverflow.com/questions/67036597,67036597,Why can't I classify my data perfectly on this simple problem using a NN?
https://stackoverflow.com/questions/67032620,67032620,Multiple variable output in Neural Network | Why is Keras yielding negative binary_cross_entropy?
https://stackoverflow.com/questions/66988763,66988763,Keras model accuracy is not improving - Image Classification
https://stackoverflow.com/questions/66981126,66981126,Accuracy increase but loss also increases
https://stackoverflow.com/questions/66977351,66977351,My machine learning model keeps predicting the wrong thing even though it has a high accuracy
https://stackoverflow.com/questions/66900614,66900614,Error computing gradients wrt input with Keras+tensorflow
https://stackoverflow.com/questions/66893949,66893949,Why does tensorflow show inaccurate loss?
https://stackoverflow.com/questions/66860294,66860294,Keras Network Using Scikit-Learn Pipeline Resulting in ValueError
https://stackoverflow.com/questions/66845924,66845924,Multi-input Multi-output Model with Keras Functional API
https://stackoverflow.com/questions/66719167,66719167,Keras: val_loss & val_accuracy are not changing
https://stackoverflow.com/questions/66667550,66667550,training loss is nan in keras LSTM
https://stackoverflow.com/questions/66615298,66615298,LSTM: loss value is not changing
https://stackoverflow.com/questions/66570592,66570592,"tensorflow.python.framework.errors_impl.InvalidArgumentError: Received a label value of 357436800 which is outside the valid range of [0, 2)"
https://stackoverflow.com/questions/66468006,66468006,Why is the keras model less accurate and not recognized?
https://stackoverflow.com/questions/66288253,66288253,How to Increase Accuracy of CNN on Image Recognition
https://stackoverflow.com/questions/66157475,66157475,Why does Keras training slow down after a while?
https://stackoverflow.com/questions/66146878,66146878,Training Accuracy not increasing - CNN with Tensorflow
https://stackoverflow.com/questions/66099474,66099474,The accuracy of fit_generator and fit is different
https://stackoverflow.com/questions/66088066,66088066,Training loss stays constant while validation loss fluctuates heavily
https://stackoverflow.com/questions/66080745,66080745,Keras Model predicts NaN
https://stackoverflow.com/questions/66040195,66040195,ValueError when running image classification model with Tensorflow/Keras
https://stackoverflow.com/questions/65946073,65946073,keras model with high loss
https://stackoverflow.com/questions/65933295,65933295,why my model performance performing so slow?
https://stackoverflow.com/questions/65879049,65879049,MultiOutput Classification with TensorFlow Extended (TFX)
https://stackoverflow.com/questions/65745053,65745053,Tensorflow softmax does not ignore masking value
https://stackoverflow.com/questions/65695581,65695581,Neural network predictions not as expected
https://stackoverflow.com/questions/65643459,65643459,Keras Nan value when computing the loss
https://stackoverflow.com/questions/65599903,65599903,Binary classification with softmax activation always outputs 1
https://stackoverflow.com/questions/65538688,65538688,Convert from sequential to Functional API model
https://stackoverflow.com/questions/65523447,65523447,Why is the tensorflow 'accuracy' value always 0 despite loss decaying and evaluation results being reasonable
https://stackoverflow.com/questions/65475136,65475136,Value error while training model in Keras
https://stackoverflow.com/questions/65408896,65408896,How to do prediction with 2 inputs?
https://stackoverflow.com/questions/65377916,65377916,Why is this ML model giving me zero accuracy?
https://stackoverflow.com/questions/65352089,65352089,Accuracy of the model is not improving despite trying different optimizers and batch sizes
https://stackoverflow.com/questions/65340258,65340258,Pytorch RNN model not learning anything
https://stackoverflow.com/questions/65285104,65285104,How could I train a keras model with one output and multiple y_true?
https://stackoverflow.com/questions/65275387,65275387,Getting pretty bad accuracy using CNN Model in Keras
https://stackoverflow.com/questions/65219970,65219970,How to design a neural network to predict arrays from arrays
https://stackoverflow.com/questions/65208382,65208382,Simple keras neural network stuck at 87.5% accuracy
https://stackoverflow.com/questions/65094975,65094975,Why is the probability predicted by my keras model always zero
https://stackoverflow.com/questions/64887009,64887009,Weird accuracy score in approximation sin
https://stackoverflow.com/questions/64878118,64878118,CNN Model Accuracy not going above 10%
https://stackoverflow.com/questions/64838581,64838581,Why I'm getting zero accuracy in Keras binary classification model?
https://stackoverflow.com/questions/64730471,64730471,I want to change the specific prediction of my CNN-model to a probability
https://stackoverflow.com/questions/64698597,64698597,Need help defining a simple neural network
https://stackoverflow.com/questions/64689483,64689483,How to do Multiclass classification with Keras?
https://stackoverflow.com/questions/64634468,64634468,Why the neural network is not learning?
https://stackoverflow.com/questions/64620819,64620819,Unable to build a model with Keras Model class
https://stackoverflow.com/questions/64522751,64522751,Poor accuracy of CNN model with Keras
https://stackoverflow.com/questions/64476565,64476565,Good training accuracy and validaiton accuracy but poor prediction accuracy
https://stackoverflow.com/questions/64446561,64446561,Neural network not learning after 1000 epochs to solve XOR problem
https://stackoverflow.com/questions/64410712,64410712,CNN not predicting class of image
https://stackoverflow.com/questions/64407887,64407887,why my loss and accuracy plots are slightly shaky?
https://stackoverflow.com/questions/64397477,64397477,Linear Regression Neural Network Tensorflow Keras Python program
https://stackoverflow.com/questions/64230643,64230643,Keras ImageDataGenerator Low Validation Accuracy
https://stackoverflow.com/questions/64188884,64188884,why is my model performing poorly for a keras sequential model?
https://stackoverflow.com/questions/64151679,64151679,Deep Neural Network Not Learning Anything
https://stackoverflow.com/questions/64140749,64140749,How to avoid stagnating loss function in tensorflow keras
https://stackoverflow.com/questions/64130293,64130293,custom loss function in Keras with masking array as input
https://stackoverflow.com/questions/64051575,64051575,How to improve accuracy and validation accuracy in deep learning
https://stackoverflow.com/questions/64030319,64030319,ECG signal QRS detection with wfdb
https://stackoverflow.com/questions/63979954,63979954,"Keras training accuracy only changing a bit, and after a few epochs it is always the same"
https://stackoverflow.com/questions/63979900,63979900,Cannot get Reproducible Results with Keras CNN Model
https://stackoverflow.com/questions/63958323,63958323,LSTM time series prediction - val and test loss lower then train loss
https://stackoverflow.com/questions/63876468,63876468,I am trying to train my model with different types of fruits
https://stackoverflow.com/questions/63835292,63835292,Keras RNN accuracy doesn't improve
https://stackoverflow.com/questions/63768722,63768722,How do I predict data using a trained keras model
https://stackoverflow.com/questions/63753111,63753111,VGG16 Net Validation Accuracy
https://stackoverflow.com/questions/63703280,63703280,How to predict a single image with Keras ImageDataGenerator?
https://stackoverflow.com/questions/63684730,63684730,Weird behaviour for my CNN validation accuracy and loss function during training phase
https://stackoverflow.com/questions/63570028,63570028,Training gets progressively slower over time
https://stackoverflow.com/questions/63564017,63564017,keras accuracy doesn't improve more than 59 percent
https://stackoverflow.com/questions/63532837,63532837,Why am I getting a constant loss and accuracy?
https://stackoverflow.com/questions/63495532,63495532,Keras: simple neural network with simple data not working
https://stackoverflow.com/questions/63492471,63492471,Keras mixed model gives same result in every epoch
https://stackoverflow.com/questions/63372983,63372983,"Validation Accuracy Stuck, Accuracy low"
https://stackoverflow.com/questions/63347272,63347272,Good training/validation accuracy but poor test accuracy
https://stackoverflow.com/questions/63342205,63342205,unstable accuracy and loss in my keras neural network model
https://stackoverflow.com/questions/63242449,63242449,The accuracy of neural network training remains unchanged
https://stackoverflow.com/questions/63233837,63233837,model.predict() - Model with accuracy near to 1 predicts wrong classes
https://stackoverflow.com/questions/63168023,63168023,Image classification in python getting not accurate prediction
https://stackoverflow.com/questions/63158891,63158891,Bidirectional LSTM gives Loss as NaN
https://stackoverflow.com/questions/63094818,63094818,Keras model gives same output for all inputs
https://stackoverflow.com/questions/63057691,63057691,Why can't sklearn MLPClassifier predict xor?
https://stackoverflow.com/questions/63048848,63048848,Model works fine in Keras but not in Tensorflow
https://stackoverflow.com/questions/63005900,63005900,Keras CNN prediction output is only predicting within a range of numbers
https://stackoverflow.com/questions/62972000,62972000,why is the accuracy constant but loss does change?
https://stackoverflow.com/questions/62930951,62930951,Overfitting - huge difference between training and validation accuracy
https://stackoverflow.com/questions/62903214,62903214,"Why is my binary classification model not learning, even to overfit?"
https://stackoverflow.com/questions/62886184,62886184,Neural Network generating negative values
https://stackoverflow.com/questions/62864745,62864745,How to make a single prediction at a time from my Keras' Neural Net
https://stackoverflow.com/questions/62817223,62817223,difference in the calculation of accuracy between keras and scikit-learn
https://stackoverflow.com/questions/62813488,62813488,Tensorflow neural network doesn鈥檛 learn
https://stackoverflow.com/questions/62752008,62752008,tensorflow 2 from Sequential to Functional
https://stackoverflow.com/questions/62729933,62729933,Creating a LSTM Neural Network outputting two Y variables
https://stackoverflow.com/questions/62673685,62673685,Tensorflow model prediction is slow
https://stackoverflow.com/questions/62665454,62665454,"Why is my accuracy and loss, 0.000 and nan, in keras?"
https://stackoverflow.com/questions/62659680,62659680,LSTM with classification
https://stackoverflow.com/questions/62606055,62606055,CNN (VGG-16) strange behaviour on validation accuracy
https://stackoverflow.com/questions/62595768,62595768,How to fix underfitting using a CNN/ why can't my code identify images correctly?
https://stackoverflow.com/questions/62590244,62590244,Validation accuracy very low but good training accuracy
https://stackoverflow.com/questions/62588326,62588326,How to increase the prediction accuracy of CNN
https://stackoverflow.com/questions/62579163,62579163,keras gives error when using two loss function for two outputs
https://stackoverflow.com/questions/62565559,62565559,Keras: autoencoder whit convolutional layers
https://stackoverflow.com/questions/62534751,62534751,How to properly setup a data set for training a Keras model
https://stackoverflow.com/questions/62464306,62464306,Why does my prediction model keep giving a different prediction result every time I run it?
https://stackoverflow.com/questions/62446077,62446077,0 accuracy with LSTM
https://stackoverflow.com/questions/62426388,62426388,Keras model's validation loss doesn't match the loss function output
https://stackoverflow.com/questions/62341053,62341053,validation accuracy not improving
https://stackoverflow.com/questions/62258350,62258350,How to use sigmoid function in python when developing a NeuralNetwork
https://stackoverflow.com/questions/62206815,62206815,Keras Neural network works but maybe something wrong with parameters
https://stackoverflow.com/questions/62205174,62205174,keras-tuner error in hyperparameter tuning
https://stackoverflow.com/questions/62135123,62135123,Discrepancy in the results of model.evaluate and model.predict in Keras
https://stackoverflow.com/questions/62100119,62100119,CNN model not learning
https://stackoverflow.com/questions/62098505,62098505,Keras model taking too long to train
https://stackoverflow.com/questions/62083918,62083918,Functional API Linking Feed-Forward Networks and Convolutional neural network
https://stackoverflow.com/questions/61974271,61974271,How do I train a neural network with tensorflow-datasets?
https://stackoverflow.com/questions/61937122,61937122,keras model prediction only one and zero instead of probability
https://stackoverflow.com/questions/61912391,61912391,Tuning the Model to Obtain Better Performance
https://stackoverflow.com/questions/61871071,61871071,keras lstm incorrect input_shape
https://stackoverflow.com/questions/61870980,61870980,Keras Model Accuracy starts from 0.667 and goes to 1.0
https://stackoverflow.com/questions/61851737,61851737,"Why does Keras gives me different results between model.evaluate, model.predicts & model.fit?"
https://stackoverflow.com/questions/61837014,61837014,How to make a Keras Neural Net output values?
https://stackoverflow.com/questions/61821775,61821775,"Good accuracy, bad predictions - CNN with TensorFlow Python"
https://stackoverflow.com/questions/61785906,61785906,Keras model not learning and predicting only one class out of three classes
https://stackoverflow.com/questions/61716422,61716422,Why is my val_loss going down but my val_accuracy stagnates
https://stackoverflow.com/questions/61706535,61706535,Keras - Validation Loss and Accuracy stuck at 0
https://stackoverflow.com/questions/61698995,61698995,tf.keras.predict() is much slower than Keras predict()
https://stackoverflow.com/questions/61687014,61687014,"Going from 10 output to 25 output CNN, but modified code is not working?"
https://stackoverflow.com/questions/61633602,61633602,Binary classification using Keras always give wrong predictions: The acc is always 0.5
https://stackoverflow.com/questions/61619700,61619700,KERAS TUNER: object of type 'HyperParameters' has no len()
https://stackoverflow.com/questions/61600482,61600482,Fruit Image Classifier (Python)
https://stackoverflow.com/questions/61580264,61580264,Keras loss changes on epoch end
https://stackoverflow.com/questions/61568463,61568463,Keras: Validation accuracy stays the exact same but validation loss decreases
https://stackoverflow.com/questions/61553510,61553510,Tensorflow 2 LSTM: InvalidArgumentError: Shapes of all inputs must match
https://stackoverflow.com/questions/61513806,61513806,Neural networks XOR returns incorrect output
https://stackoverflow.com/questions/61488904,61488904,"Received a label value of 200837 which is outside the valid range of [0, 171) when training a python keras sequential model"
https://stackoverflow.com/questions/61434753,61434753,Neural net has high accuracy but all predictions are wrong
https://stackoverflow.com/questions/61425296,61425296,Why neural network predicts wrong on its own training data?
https://stackoverflow.com/questions/61314247,61314247,Not able to reproduce results with Tensorflow even with random seed
https://stackoverflow.com/questions/61294801,61294801,Keras Accuracy and Loss not changing over a large period of epochs
https://stackoverflow.com/questions/61167687,61167687,Simple single layer neural network
https://stackoverflow.com/questions/61149201,61149201,Does Keras ignore labels of masked values?
https://stackoverflow.com/questions/61143173,61143173,Simple Tensorflow 2 classifier won't learn
https://stackoverflow.com/questions/61130836,61130836,Convert Functional Model to Sequential Keras
https://stackoverflow.com/questions/61122276,61122276,Keras not training on entire dataset
https://stackoverflow.com/questions/61102948,61102948,Why these Keras Sequential model and Functional API act differently?
https://stackoverflow.com/questions/61049990,61049990,How to train a multi-class image classifier with Keras
https://stackoverflow.com/questions/61032817,61032817,Overfitting problem with my validation data
