url,id,title
https://stackoverflow.com/questions/60931790,60931790,Big difference between val-acc and prediction accuracy in Keras Neural Network
https://stackoverflow.com/questions/60797725,60797725,"Keras - GRU layer with recurrent dropout - loss: 'nan', accuracy: 0"
https://stackoverflow.com/questions/60766493,60766493,Scaling data for neural network
https://stackoverflow.com/questions/60761415,60761415,Keras model loss function returning nan
https://stackoverflow.com/questions/60691599,60691599,Sudden drop in validation accuracy during training
https://stackoverflow.com/questions/60681221,60681221,"Keras CNN val_accuracy, loss, accuracy stuck"
https://stackoverflow.com/questions/60660394,60660394,How to feed output of keras LSTM layer into input layer?
https://stackoverflow.com/questions/60622685,60622685,Keras: .predict returns percentages instead of classes
https://stackoverflow.com/questions/60596666,60596666,ML Model giving me Zero accuracy
https://stackoverflow.com/questions/60595614,60595614,Keras predict accuracy does not match to fit's result
https://stackoverflow.com/questions/60550005,60550005,"Keras - Conv2D expects (1,1,1) and got (258, 540, 3)"
https://stackoverflow.com/questions/60535110,60535110,Tensorflow model accuracy low
https://stackoverflow.com/questions/60475162,60475162,Why is my neural network validation accuracy higher than my training accuracy and they both become constant?
https://stackoverflow.com/questions/60393573,60393573,Classification Neural Network does not learn
https://stackoverflow.com/questions/60370887,60370887,How to create training and testing data and feed into keras model?
https://stackoverflow.com/questions/60364041,60364041,"CNN validation accuracy high, but bad at predictions?"
https://stackoverflow.com/questions/60346044,60346044,Keras loss function value doesn't decrease
https://stackoverflow.com/questions/60290208,60290208,Why training accuracy is not improving?
https://stackoverflow.com/questions/60288003,60288003,why my Tensorflow CNN's accuracy is zero while loss is not?
https://stackoverflow.com/questions/60283444,60283444,Training accuracy is less than validation accuracy
https://stackoverflow.com/questions/60267911,60267911,Keras inconsistent prediction time
https://stackoverflow.com/questions/60267894,60267894,How can I get better accuracy from my neural network.What is wrong with my code?
https://stackoverflow.com/questions/60246169,60246169,Finding the appropriate CNN Model Architecture and Parameters
https://stackoverflow.com/questions/60173627,60173627,"Deep Learning model not accurately predicting , Keras?"
https://stackoverflow.com/questions/60118607,60118607,I don't exactly understand how am I going to predict custom data with keras
https://stackoverflow.com/questions/60095832,60095832,Binary image classifier always predicting one class
https://stackoverflow.com/questions/60035755,60035755,How do I know if my Neural Network model is overfitting or not (Keras)
https://stackoverflow.com/questions/59997042,59997042,How to produce 1 output with multiple input variables LSTM
https://stackoverflow.com/questions/59980207,59980207,MLPClassfier predict and predict_proba seem inconsistent
https://stackoverflow.com/questions/59931473,59931473,Keras: Overfitting Model?
https://stackoverflow.com/questions/59837926,59837926,Keep Getting Accuracy zero when training Neural Network - Python
https://stackoverflow.com/questions/59788599,59788599,What are some reasons Bayesian Optimization might not work for a CNN
https://stackoverflow.com/questions/59740444,59740444,Accuracy remains constant after every epoch
https://stackoverflow.com/questions/59704981,59704981,Tensorflow slow performances using tf.data.Dataset
https://stackoverflow.com/questions/59663017,59663017,Loss function in Keras does not match analogical function
https://stackoverflow.com/questions/59590085,59590085,how do I mask the input of lstm in tf.keras
https://stackoverflow.com/questions/59553390,59553390,Keras LSTM Model not learning
https://stackoverflow.com/questions/59518294,59518294,How to sovle audio signal problem by using 1D conv neural network in keras
https://stackoverflow.com/questions/59490066,59490066,Validation data performing worse than training data in keras
https://stackoverflow.com/questions/59457567,59457567,How can I create Multiple Input One Output LSTM Model with Keras?
https://stackoverflow.com/questions/59454562,59454562,How to build a neural network with one single hidden layer using keras?
https://stackoverflow.com/questions/59449308,59449308,How to use trained deep learning model to predict in excel?
https://stackoverflow.com/questions/59399842,59399842,Xor gate with Backpropagation
https://stackoverflow.com/questions/59325381,59325381,Low accuracy after training a CNN
https://stackoverflow.com/questions/59201907,59201907,Overfitting on image classification
https://stackoverflow.com/questions/59138513,59138513,Keras sequential model not training (Stuck on the same Accuracy and Loss)
https://stackoverflow.com/questions/59132526,59132526,loss value don't change(neural network)
https://stackoverflow.com/questions/59131007,59131007,Keras Binary Classifier Tutorial Example gives only 50% validation accuracy
https://stackoverflow.com/questions/59129802,59129802,LOSS not changeing in very simple KERAS binary classifier
https://stackoverflow.com/questions/59081232,59081232,How to convert the following sequential model into a functional model in keras
https://stackoverflow.com/questions/59015351,59015351,The predict_proba() function of MLPClassifier from sklearn outputs the total possibility is not equal to one
https://stackoverflow.com/questions/58855234,58855234,predict result for single record using keras model predict
https://stackoverflow.com/questions/58847723,58847723,Keras Network is not learning
https://stackoverflow.com/questions/58649672,58649672,Significance of loss in classification with Keras
https://stackoverflow.com/questions/58582301,58582301,Prediction is identical for all input data in Multi-Label Classification (NLP)
https://stackoverflow.com/questions/58552433,58552433,"Cifar-100 Dataset Error - Received a label value of 97 which is outside the valid range of [0, 10)"
https://stackoverflow.com/questions/58527815,58527815,How to preprocess and feed data to keras model?
https://stackoverflow.com/questions/58508286,58508286,TensorFlow Model not performing any training
https://stackoverflow.com/questions/58500095,58500095,Keras Multilayer Perceptron train data show loss = nan
https://stackoverflow.com/questions/58481824,58481824,how to fix overfitting or where is my fault in my code
https://stackoverflow.com/questions/58474361,58474361,Good accuracy but wrong prediction
https://stackoverflow.com/questions/58465027,58465027,CNN training loss stuck at values between 51-60
https://stackoverflow.com/questions/58455975,58455975,Validation accuracy not improving after reaching 90%
https://stackoverflow.com/questions/58436796,58436796,How to teach keras neural network to solve sqrt
https://stackoverflow.com/questions/58408578,58408578,Keras VGG16 low validation accuracy
https://stackoverflow.com/questions/58344477,58344477,Keras image classification: High accuracy shown but low on test images
https://stackoverflow.com/questions/58329949,58329949,How to increase validation accuracy?
https://stackoverflow.com/questions/58299659,58299659,"Keras model.predict with sigmoid activation and binary cross entropy returns only 0 or 1, not probability"
https://stackoverflow.com/questions/58277179,58277179,Accuracy is zero all the time
https://stackoverflow.com/questions/58252954,58252954,Keras model only working with Sigmoid activation
https://stackoverflow.com/questions/58220535,58220535,Keras: training of loaded model is 6x slower
https://stackoverflow.com/questions/58146961,58146961,Keras fit_generator doesn't predict the same as fit
https://stackoverflow.com/questions/58120931,58120931,The loss and accuracy of this LSTM both drop to nearly 0 at the same epoch
https://stackoverflow.com/questions/58119629,58119629,Validation Accuracy of CNN not increasing
https://stackoverflow.com/questions/58108454,58108454,relu function neural network outputting 0 or 1
https://stackoverflow.com/questions/58083502,58083502,Binary Classification Neural Network: both Nan loss and NaN predictions
https://stackoverflow.com/questions/58043606,58043606,Keras predicts same result for any input
https://stackoverflow.com/questions/58032882,58032882,Keras CNN high accuracy but bad predictions. How to improve it
https://stackoverflow.com/questions/58028976,58028976,TypeError: Unexpected keyword argument passed to optimizer: learning_rate
https://stackoverflow.com/questions/57976140,57976140,Keras model learning to give wrong answers training accuracy raising to 0.8 to then deacrease dramatically down to 0.1
https://stackoverflow.com/questions/57962057,57962057,Unwanted [Nan] output in Python neural network
https://stackoverflow.com/questions/57950901,57950901,One hot encoding of multi label images in keras
https://stackoverflow.com/questions/57835069,57835069,Kernel Threw Exception in kaggle submission
https://stackoverflow.com/questions/57787386,57787386,How to increase accuracy in Convolutional neural network
https://stackoverflow.com/questions/57771706,57771706,Why is accuracy and loss staying exactly the same while training?
https://stackoverflow.com/questions/57658571,57658571,Predicting a single image with Keras' ImageDataGenerator
https://stackoverflow.com/questions/57605741,57605741,Convolutional Net Model not working on very simple data
https://stackoverflow.com/questions/57592155,57592155,Basic time series prediction with lstm
https://stackoverflow.com/questions/57559917,57559917,Overfitting DL model?
https://stackoverflow.com/questions/57453511,57453511,Why would the loss decrease while the accuracy stays the same?
https://stackoverflow.com/questions/57208478,57208478,Loss not decrasing and is very high keras
https://stackoverflow.com/questions/57182449,57182449,Loss is NaN on image classification task
https://stackoverflow.com/questions/57154594,57154594,"How to fix tensorflow ""InvalidArgumentError: Shapes of all inputs must match"""
https://stackoverflow.com/questions/57154569,57154569,shape of output tensor by keras.losses.binary_crossentropy
https://stackoverflow.com/questions/57147999,57147999,my model's Training/Validation accuracy behave strange
https://stackoverflow.com/questions/57141521,57141521,CNN giving random answers while fully-connected neural network works fine
https://stackoverflow.com/questions/57115833,57115833,Why tensorflow is slower with GPU instead of CPU?
https://stackoverflow.com/questions/57093511,57093511,How to increase the accuracy of my cnn model?
https://stackoverflow.com/questions/57026595,57026595,Model accuracy stuck at 0.2505. What is wrong with my code?
https://stackoverflow.com/questions/56913286,56913286,Unable to train neural network properly
https://stackoverflow.com/questions/56895339,56895339,Following a TensorFlow tutorial and am not getting accurate model predictions
https://stackoverflow.com/questions/56893429,56893429,Validation accuracy/loss goes up and down linearly with every consecutive epoch
https://stackoverflow.com/questions/56841451,56841451,Why is my neural net only predicting one class (binary classification)?
https://stackoverflow.com/questions/56815476,56815476,Very good validation accuracy but bad predictions
https://stackoverflow.com/questions/56797099,56797099,Label value is outside the valid range
https://stackoverflow.com/questions/56708518,56708518,tensorflow mnist neural network model low accuracy
https://stackoverflow.com/questions/56632808,56632808,Why is my validation accuracy stuck around 65% and how do i increase it?
https://stackoverflow.com/questions/56564555,56564555,"Very high training accuracy and low loss during training, but bad classification"
https://stackoverflow.com/questions/56545687,56545687,keras will only give accuracy of 0.5001
https://stackoverflow.com/questions/56538095,56538095,"Overfitting Problem, validation success rate way low than training. What can I change?"
https://stackoverflow.com/questions/56523793,56523793,Keras MLP classifier not learning
https://stackoverflow.com/questions/56450080,56450080,when training sample increases accuracy decreases
https://stackoverflow.com/questions/56416190,56416190,I get different result for the same keras model
https://stackoverflow.com/questions/56308413,56308413,Unable to solve the XOR problem with just two hidden neurons in Python
https://stackoverflow.com/questions/56217358,56217358,Accuracy of LSTM model is very low
https://stackoverflow.com/questions/56207651,56207651,Why doesn't the accuracy when training VGG-16 change much?
https://stackoverflow.com/questions/56194642,56194642,"Error when running LSTM model, Loss: NaN values"
https://stackoverflow.com/questions/56163009,56163009,How inputs are being taken in keras?
https://stackoverflow.com/questions/56032900,56032900,why does keras model.predict only return one probability?How can I output all probabilities of all the classes?
https://stackoverflow.com/questions/56022302,56022302,My CNN image recognition model produces fluctuating validation loss
https://stackoverflow.com/questions/56001866,56001866,Why is the validation accuracy constant at 20%?
https://stackoverflow.com/questions/55954602,55954602,Image Classifier with Tensorflow and Keras
https://stackoverflow.com/questions/55949613,55949613,CNN on small dataset is overfiting
https://stackoverflow.com/questions/55944143,55944143,Multi-class Keras perceptron classifier is classifying everything as a single class
https://stackoverflow.com/questions/55930227,55930227,keras predict only gives 1 but loss value decrease
https://stackoverflow.com/questions/55882618,55882618,Why won't accuracy increase when training this CNN?
https://stackoverflow.com/questions/55779691,55779691,How can I convert the sigmoid activation function outputs to 0s and 1s?
https://stackoverflow.com/questions/55776436,55776436,Keras: CNN model is not learning
https://stackoverflow.com/questions/55776200,55776200,Keras neural network prediction not working
https://stackoverflow.com/questions/55736880,55736880,Keras model predict output is an array with values between 0 and 1
https://stackoverflow.com/questions/55704873,55704873,Why I get nan for Keras loss?
https://stackoverflow.com/questions/55695575,55695575,Testing accuracy higher than training accuracy
https://stackoverflow.com/questions/55670349,55670349,Errors with simple Neural Network in Keras/Tensorflow
https://stackoverflow.com/questions/55666255,55666255,Why is my keras model always predicting the same result?
https://stackoverflow.com/questions/55660172,55660172,Is that possible to get only 0 and 1 For multiclass multilabel problem in tensorflow.keras.models.Sequential.predict?
https://stackoverflow.com/questions/55566617,55566617,Model trained using LSTM is predicting only same value for all
https://stackoverflow.com/questions/55549537,55549537,Tensorflow CNN zero accuracy?
https://stackoverflow.com/questions/55431690,55431690,"Keras network fit: loss is 'nan', accuracy doesn't change"
https://stackoverflow.com/questions/55382747,55382747,Training loss does not decrease
https://stackoverflow.com/questions/55375849,55375849,Keras stops learning at one point
https://stackoverflow.com/questions/55339103,55339103,How to build input function for a estimator created from keras model
https://stackoverflow.com/questions/55322991,55322991,Why am I getting Nan after adding relu activation in LSTM?
https://stackoverflow.com/questions/55321843,55321843,Why my keras code doesn't show the accuracy value?
https://stackoverflow.com/questions/55317559,55317559,"how to improve neural network prediction, classification"
https://stackoverflow.com/questions/55309566,55309566,Keras model.predict only returns one figure for binary classification task
https://stackoverflow.com/questions/55266853,55266853,how to increase model accuracy in image classification model
https://stackoverflow.com/questions/55212422,55212422,Multiple Features at the Input Layer Keras Python
https://stackoverflow.com/questions/55177781,55177781,"Tensorflow: my rnn always output same value, weights of rnn are not trained"
https://stackoverflow.com/questions/55170460,55170460,Neural network for square (x^2) approximation
https://stackoverflow.com/questions/55097362,55097362,Different accuracy by fit() and evaluate() in Keras with the same dataset
https://stackoverflow.com/questions/55051978,55051978,Loss of CNN in Keras becomes nan at some point of training
https://stackoverflow.com/questions/55005691,55005691,Keras model (even during training) only predicts 0
https://stackoverflow.com/questions/54883847,54883847,loss NAN when use keras training ANN classification
https://stackoverflow.com/questions/54854934,54854934,Image classification exception - InvalidArgumentError of the given labels
https://stackoverflow.com/questions/54849499,54849499,Neural Network classification
https://stackoverflow.com/questions/54816056,54816056,Tensorflow Image Classification Python Always Saying Same Answer
https://stackoverflow.com/questions/54732675,54732675,Python Keras Prediction returning nan
https://stackoverflow.com/questions/54580679,54580679,Sklearn metrics values are very different from Keras values
https://stackoverflow.com/questions/54565092,54565092,"Keras - my model always returns accuracy ""0"" and loss ""nan"""
https://stackoverflow.com/questions/54509928,54509928,Why is Keras training well but returning wrong predictions?
https://stackoverflow.com/questions/54377389,54377389,Keras ImageDataGenerator: why are the outputs of my CNN reversed?
https://stackoverflow.com/questions/54354201,54354201,how to convert the Keras sequential API to functional API
https://stackoverflow.com/questions/54332796,54332796,Training an autoencoder on my data using Keras
https://stackoverflow.com/questions/54272461,54272461,Keras Neural Network accuracy only 10%
https://stackoverflow.com/questions/54263218,54263218,CNN-Divide images into training/validation/testing
https://stackoverflow.com/questions/54248280,54248280,Neural Network model
https://stackoverflow.com/questions/54231049,54231049,Keras model accuracy not improving
https://stackoverflow.com/questions/54207049,54207049,"Keras CNN: validation accuracy stuck at 70%, training accuracy reaching 100%"
https://stackoverflow.com/questions/54144475,54144475,Tensorflow Keras sigmoid activation in functional API
https://stackoverflow.com/questions/54125577,54125577,LSTM in Keras returns always the same output
https://stackoverflow.com/questions/54103770,54103770,Object Localization Keras | Predicts the whole image
https://stackoverflow.com/questions/54096140,54096140,Keras CNN - loss continuously decreases but accuracy converges quickly
https://stackoverflow.com/questions/54071443,54071443,real time signal ecg processing
https://stackoverflow.com/questions/54025916,54025916,convolutional neural network for object localization
https://stackoverflow.com/questions/53988889,53988889,Why does my keras model not train at all?
https://stackoverflow.com/questions/53981991,53981991,Using sigmoid activation function for multi-class prediction
https://stackoverflow.com/questions/53979199,53979199,TensorFlow Keras returning multiple predictions while expecting one
https://stackoverflow.com/questions/53966446,53966446,LSTM architecture in Keras implementation?
https://stackoverflow.com/questions/53953528,53953528,How can I create a neural network with Keras that trains from tabular data?
https://stackoverflow.com/questions/53930651,53930651,Wrong model prediction
https://stackoverflow.com/questions/53876097,53876097,Keras model doesn't learn at all
https://stackoverflow.com/questions/53869349,53869349,Keras prediction returns the same results each time
https://stackoverflow.com/questions/53839351,53839351,Shape error when training a model with Keras (Tensorflow)
https://stackoverflow.com/questions/53804330,53804330,"Image classification using Keras,CNN training very SLOWLY"
https://stackoverflow.com/questions/53763021,53763021,Keras masking layer as input to lstm layer
https://stackoverflow.com/questions/53689840,53689840,Why my model's training and validation accuracy remains constant after one epoch? [Keras]
https://stackoverflow.com/questions/53640858,53640858,Loss: NaN in Keras while performing regression
https://stackoverflow.com/questions/53581388,53581388,Neural network for beginner
https://stackoverflow.com/questions/53562493,53562493,Keras returns binary results
https://stackoverflow.com/questions/53553797,53553797,Usage of sigmoid activation function in Keras
https://stackoverflow.com/questions/53524520,53524520,"Neural network can learn |sin(x)| for [0,pi] but not [0,2pi] or [0, 4pi]"
https://stackoverflow.com/questions/53501575,53501575,Tensorflow/Keras multi-label classifier
https://stackoverflow.com/questions/53494627,53494627,Loss in Keras Model evaluation
https://stackoverflow.com/questions/53488768,53488768,Keras functional API: Combine CNN model with a RNN to to look at sequences of images
https://stackoverflow.com/questions/53482251,53482251,How to Convert Keras Prediction Output to desired Binary Value
https://stackoverflow.com/questions/53481675,53481675,Keras Always Output a Constant Value
https://stackoverflow.com/questions/53452745,53452745,Regression: How can I approximate a multi-dimensional function?
https://stackoverflow.com/questions/53396670,53396670,Unable to reproduce tensorflow results even after setting random seed
https://stackoverflow.com/questions/53389331,53389331,How can I get multiple outputs in an LSTM network in Python with Keras and Tensorflow?
https://stackoverflow.com/questions/53374114,53374114,"Tensorflow accuracy stuck at 25% for 4 labels, text classification"
https://stackoverflow.com/questions/53359127,53359127,Keras-- low accuracy with LSTM layer but the accuracy is good without LSTM
https://stackoverflow.com/questions/53330006,53330006,CNN - Wrong prediction with multiclass classification
https://stackoverflow.com/questions/53277246,53277246,The results after each training keras model are different
https://stackoverflow.com/questions/53265281,53265281,How to improve prediction with keras and tensorflow
https://stackoverflow.com/questions/53242875,53242875,Accuracy Decreasing with higher epochs
https://stackoverflow.com/questions/53194704,53194704,Keras loss function understanding
https://stackoverflow.com/questions/53194564,53194564,Tensorflow Keras CuDNN LSTM layers do not support Masking
https://stackoverflow.com/questions/53177605,53177605,Model not learning
https://stackoverflow.com/questions/53131397,53131397,Loss function Keras out_dim > 1
https://stackoverflow.com/questions/53071588,53071588,Can't figure out why I'm only getting one value from predict function?
https://stackoverflow.com/questions/53047848,53047848,keras LSTM poor prediction
https://stackoverflow.com/questions/52929868,52929868,"Simple binary classification by CNN with Keras, But got only 50% acc"
https://stackoverflow.com/questions/52880384,52880384,Keras loss becomes nan only at epoch end
https://stackoverflow.com/questions/52857959,52857959,Same output of the Keras model
https://stackoverflow.com/questions/52775197,52775197,Tensorflow model outputs probability values larger than 1
https://stackoverflow.com/questions/52653320,52653320,predict_proba() method of Keras model does not exist
https://stackoverflow.com/questions/52647115,52647115,python - Implementing an LSTM network with Keras and TensorFlow
https://stackoverflow.com/questions/52632567,52632567,Keras fit and fit_generator returns quite different results
https://stackoverflow.com/questions/52595477,52595477,Why is this Keras Conv2D layer not compatible with the input?
https://stackoverflow.com/questions/52483437,52483437,Poor accuracy of Keras VGG16 while reproducing paper results
https://stackoverflow.com/questions/52463634,52463634,"Tensorflow, square root activation function implementation (shaping error)"
https://stackoverflow.com/questions/52462058,52462058,Keras Image Preprocessing
https://stackoverflow.com/questions/52459748,52459748,image multi classification with keras
https://stackoverflow.com/questions/52455928,52455928,keras loss is nan but accuracy well defined
https://stackoverflow.com/questions/52448552,52448552,Cannot find the reason behind very low accuracy in my Convolutional Net model with Keras
https://stackoverflow.com/questions/52445293,52445293,Bad performance of the model Keras
https://stackoverflow.com/questions/52435394,52435394,Replacing sigmoid activation with custom activation
https://stackoverflow.com/questions/52423163,52423163,Sigmoid function returns 1 for large positive inputs
https://stackoverflow.com/questions/52376142,52376142,Predicting in Keras with LSTM layer
https://stackoverflow.com/questions/52326106,52326106,Keras seems slower than tensorflow while feeding training data
https://stackoverflow.com/questions/52282108,52282108,Keras: Accuracy Drops While Finetuning Inception
https://stackoverflow.com/questions/52254466,52254466,InvalidArgumentError: Incompatible shapes with Keras LSTM Net
https://stackoverflow.com/questions/52231830,52231830,Neural Network architecture to learn function
https://stackoverflow.com/questions/52220242,52220242,Why does the loss of a CNN decrease for a long time and then suddenly increase?
https://stackoverflow.com/questions/52208950,52208950,CNN Model With Low Accuracy
https://stackoverflow.com/questions/52205479,52205479,Negative Binomial Loss in Neural Network using Tensorflow / Keras
https://stackoverflow.com/questions/52188991,52188991,Keras CNN - Model either underfitting or overfitting
