url,id,title
https://stackoverflow.com/questions/52184053,52184053,Why do I have such inconsistent results when training my model?
https://stackoverflow.com/questions/52085388,52085388,"Keras model loss starts at 0, but only sometimes"
https://stackoverflow.com/questions/52027278,52027278,Do I need a stateful or stateless LSTM?
https://stackoverflow.com/questions/52009816,52009816,How to know if underfitting or overfitting is occuring?
https://stackoverflow.com/questions/51999181,51999181,Training accuracy improves but validation accuracy remains same
https://stackoverflow.com/questions/51971180,51971180,"Keras GRU model predicts only [-0., -0., -0., -0., -0.]"
https://stackoverflow.com/questions/51933123,51933123,How to fix a constant validation accuracy in machine learning?
https://stackoverflow.com/questions/51931932,51931932,LSTM prediction model : the loss value doesn't change
https://stackoverflow.com/questions/51902539,51902539,Make a simple KERAS network for classification
https://stackoverflow.com/questions/51885923,51885923,Keras model building
https://stackoverflow.com/questions/51882681,51882681,Python simple neural network code not working
https://stackoverflow.com/questions/51874969,51874969,one class classification with keras
https://stackoverflow.com/questions/51840826,51840826,Unable to train simple autoencoder in Keras
https://stackoverflow.com/questions/51828971,51828971,Tensorflow model accuracy not increasing
https://stackoverflow.com/questions/51814138,51814138,Why isn't my XOR tensorflow network learning?
https://stackoverflow.com/questions/51785432,51785432,Neural net with duplicated inputs - Keras
https://stackoverflow.com/questions/51728551,51728551,Simple Tensorflow architecture not training
https://stackoverflow.com/questions/51706774,51706774,Keras model giving constantly same output class?
https://stackoverflow.com/questions/51695149,51695149,Deep Learning: Validation Loss Fluctuates Wildly Yet Training Loss is Stable
https://stackoverflow.com/questions/51658122,51658122,"Keras loss is in negative and accuracy is going down, but predictions are good?"
https://stackoverflow.com/questions/51627825,51627825,Inconsistency in Keras Sequential model vs Functional API
https://stackoverflow.com/questions/51570785,51570785,Why my ANN is not learning?
https://stackoverflow.com/questions/51515544,51515544,Tensorflow faster rcnn giving good detection but still detecting false positives with coco objects
https://stackoverflow.com/questions/51506957,51506957,Getting all the same values in keras model.predict
https://stackoverflow.com/questions/51466437,51466437,Does my Keras Neural Networks accuracy always get stuck around a value of ~0.55 because of my optimizer?
https://stackoverflow.com/questions/51453964,51453964,Image Classification with TensorFlow and Keras
https://stackoverflow.com/questions/51445857,51445857,Signal classification based on keras stateful LSTM
https://stackoverflow.com/questions/51445689,51445689,Why I'm getting all 1s in keras when I use model.predict?
https://stackoverflow.com/questions/51441690,51441690,how to prevent negative predictions in keras custom loss function
https://stackoverflow.com/questions/51374115,51374115,Why my Keras Image classification prediction always return one value...?
https://stackoverflow.com/questions/51365661,51365661,Why does more epochs make my model worse?
https://stackoverflow.com/questions/51335133,51335133,Keras: How come 'accuracy' is higher than 'val_acc'?
https://stackoverflow.com/questions/51312608,51312608,I can not train a logical operation xor
https://stackoverflow.com/questions/51309569,51309569,Keras Training Why Training accuracy Increases while the validation accuracy remains same?
https://stackoverflow.com/questions/51308774,51308774,Predictions more than 1 or negative in Keras
https://stackoverflow.com/questions/51203785,51203785,couldn't train a model in keras
https://stackoverflow.com/questions/51200361,51200361,Constructing a keras model
https://stackoverflow.com/questions/51187664,51187664,"Why is this keras network not ""learning""?"
https://stackoverflow.com/questions/51163411,51163411,Keras neural network function approximation
https://stackoverflow.com/questions/51156573,51156573,Why is my Neural Net not learning
https://stackoverflow.com/questions/51142990,51142990,Accuracy value doesn't match prediction result of my keras model
https://stackoverflow.com/questions/51125933,51125933,LSTM layer returns nan when fed by its own output in PyTorch
https://stackoverflow.com/questions/51113328,51113328,"Keras high loss, not decreasing with each epoch"
https://stackoverflow.com/questions/51091758,51091758,Learning a Sin function
https://stackoverflow.com/questions/51063631,51063631,How to create correctly an estimator with TensorFlow
https://stackoverflow.com/questions/50964401,50964401,Image classification: Best approach to training the model
https://stackoverflow.com/questions/50910828,50910828,Keras model doesn't seem to work
https://stackoverflow.com/questions/50863516,50863516,Issue in extracting Titanic training data from Kaggle using Jupyter Notebook
https://stackoverflow.com/questions/50837715,50837715,Conversion of a sequential model to a functional model with Keras 2.2.0
https://stackoverflow.com/questions/50831870,50831870,"CNN with keras, accuracy remains constant and does not improve"
https://stackoverflow.com/questions/50820527,50820527,Why does my model accuracy get stuck at ~32%?
https://stackoverflow.com/questions/50797135,50797135,Why does this neural network have zero accuracy and very low loss?
https://stackoverflow.com/questions/50787555,50787555,Can't train a keras model to approximate a simple function
https://stackoverflow.com/questions/50756732,50756732,training accuracy drops in tensorflow
https://stackoverflow.com/questions/50718447,50718447,A neural networks with two outputs
https://stackoverflow.com/questions/50703359,50703359,How to develop a convolutional neural network to differentiate images with similar features?
https://stackoverflow.com/questions/50672583,50672583,Keras: Categorical vs Continuous input to a LSTM
https://stackoverflow.com/questions/50596163,50596163,Getting loss value as 0 when training a neural network
https://stackoverflow.com/questions/50513539,50513539,Cannot reproduce results with Keras
https://stackoverflow.com/questions/50452598,50452598,Sigmoid of x is 1
https://stackoverflow.com/questions/50394921,50394921,Keras explanation: number of nodes in input layer
https://stackoverflow.com/questions/50380863,50380863,RNN/LSTM deep learning model?
https://stackoverflow.com/questions/50306988,50306988,Neural net fails on toy dataset
https://stackoverflow.com/questions/50266585,50266585,Implementing sigmoid function in python
https://stackoverflow.com/questions/50244697,50244697,neural network xor gate classification
https://stackoverflow.com/questions/50227925,50227925,How to predict from saved model in Keras ?
https://stackoverflow.com/questions/50140500,50140500,"Keras NN regression model gives low loss, and 0 acuracy"
https://stackoverflow.com/questions/50115762,50115762,Output Probability score with keras using model.predict()
https://stackoverflow.com/questions/49971092,49971092,Tensorflow - Model Only Predicting 2 Classes Out of 6
https://stackoverflow.com/questions/49930518,49930518,LSTM timeseries prediction with multiple outputs
https://stackoverflow.com/questions/49912503,49912503,Multiple predictions of multi-class image classification with Keras
https://stackoverflow.com/questions/49882424,49882424,Keras Tensorflow Binary Cross entropy loss greater than 1
https://stackoverflow.com/questions/49837507,49837507,"good accuracy , but bad prediction with keras"
https://stackoverflow.com/questions/49811350,49811350,Python | Keras | Prediction with Multiple Variables
https://stackoverflow.com/questions/49806496,49806496,Loss and accuracy don't change during the training phase
https://stackoverflow.com/questions/49779836,49779836,python keras neural network prediction not working (outputs 0 or 1)
https://stackoverflow.com/questions/49741328,49741328,Simple Neural Network built from scratch is not learning
https://stackoverflow.com/questions/49739356,49739356,Keras: convolutional layer for 1D input
https://stackoverflow.com/questions/49729362,49729362,nan on loss function tensorflow
https://stackoverflow.com/questions/49661708,49661708,Keras LSTM Multiple Input Multiple Output
https://stackoverflow.com/questions/49633321,49633321,Keras - Loss Nan and 0.333 accuracy throughout the training
https://stackoverflow.com/questions/49560420,49560420,Deep Learning implementation in Tensorflow or Keras give drastic different results
https://stackoverflow.com/questions/49492740,49492740,"Tensorflow InvalidArgumentError: indices[40] = 2000 0 is not in [0, 20000)"
https://stackoverflow.com/questions/49404205,49404205,how to input data into KERAS python?
https://stackoverflow.com/questions/49369176,49369176,Deep autoencoder keeping constant accuracy in keras
https://stackoverflow.com/questions/49332994,49332994,Python - Low accuracy with low loss with tensorflow
https://stackoverflow.com/questions/49312989,49312989,Keras: calculating derivatives of model output wrt input returns [None]
https://stackoverflow.com/questions/49275827,49275827,Preblem in shape of data with Conv1D in Keras
https://stackoverflow.com/questions/49254249,49254249,How to One input and Three output LSTM tensorflow
https://stackoverflow.com/questions/49216731,49216731,Output of conv2d in keras
https://stackoverflow.com/questions/49213870,49213870,"High val_acc, but low accuracy in practice"
https://stackoverflow.com/questions/49145544,49145544,Tensorflow: loss value is inconsistent with accuracy
https://stackoverflow.com/questions/49135929,49135929,Keras Binary Classification - Sigmoid activation function
https://stackoverflow.com/questions/49085619,49085619,Convolutional Neural Network Loss
https://stackoverflow.com/questions/48967068,48967068,Loss become Nan suddenly after some iterations
https://stackoverflow.com/questions/48817095,48817095,Keras - How to actually use an autoencoder
https://stackoverflow.com/questions/48796619,48796619,Why is TF Keras inference way slower than Numpy operations?
https://stackoverflow.com/questions/48754467,48754467,Function approximation Tensorflow
https://stackoverflow.com/questions/48714786,48714786,Loss & val_loss of keras CNN
https://stackoverflow.com/questions/48619600,48619600,Stagnant validation accuracy during training of vgg net with 10000 images
https://stackoverflow.com/questions/48604708,48604708,Tensorflow returns 10% validation accuracy for VGG model (irrespective of number of epochs)?
https://stackoverflow.com/questions/48594888,48594888,"CNN train accuracy gets better during training, but test accuracy stays around 40%"
https://stackoverflow.com/questions/48562099,48562099,Keras : Why does Sequential and Model give different outputs?
https://stackoverflow.com/questions/48539256,48539256,Bigger neural network converges to bigger error than smaller
https://stackoverflow.com/questions/48513397,48513397,Keras validation loss
https://stackoverflow.com/questions/48500037,48500037,Approximating multidimensional functions with neural networks
https://stackoverflow.com/questions/48490280,48490280,Keras custom loss not calculated correctly
https://stackoverflow.com/questions/48458635,48458635,Getting very bad prediction with KerasRegressor
https://stackoverflow.com/questions/48351688,48351688,input preprocessing in Keras
https://stackoverflow.com/questions/48286504,48286504,Weird Nan loss for custom Keras loss
https://stackoverflow.com/questions/48239431,48239431,Wrong prediction on images
https://stackoverflow.com/questions/48229635,48229635,CIFAR-10 Dataset using Keras
https://stackoverflow.com/questions/48217119,48217119,keras - get probability per each class
https://stackoverflow.com/questions/48216574,48216574,ANN: keras/sklearn doesn't scale well
https://stackoverflow.com/questions/48187607,48187607,accuracy not increasing in tensorflow model
https://stackoverflow.com/questions/48140133,48140133,use negative loss in tensorflow
https://stackoverflow.com/questions/48129814,48129814,Keras LSTM Converges on the Dataset's Mean Value
https://stackoverflow.com/questions/48126996,48126996,Keras autoencoder negative loss and val_loss with data in range [-1 1]
https://stackoverflow.com/questions/48121895,48121895,Poor accuracy in Tensorflow CNN implementation
https://stackoverflow.com/questions/48041867,48041867,Why is accuracy different between Keras model.fit and model.evaluate?
https://stackoverflow.com/questions/47947629,47947629,"Tensorflow: Keras, Estimators and custom input function"
https://stackoverflow.com/questions/47932589,47932589,Neural network: estimating sine wave frequency
https://stackoverflow.com/questions/47750930,47750930,Keras always predicting the same output
https://stackoverflow.com/questions/47723487,47723487,XOR neural network 2-1-1
https://stackoverflow.com/questions/47626469,47626469,convnet suddenly drop accuracy
https://stackoverflow.com/questions/47599436,47599436,Returning probabilities in a classification prediction in Keras?
https://stackoverflow.com/questions/47564039,47564039,Keras: why the accuracy not changing when training
https://stackoverflow.com/questions/47442792,47442792,Keras: loss keeps increasing
https://stackoverflow.com/questions/47429267,47429267,Why is this neural network's loss always 0.0 and accuracy always 1.0?
https://stackoverflow.com/questions/47346809,47346809,Negative result for regression using Keras and Tensorflow
https://stackoverflow.com/questions/47338980,47338980,Tensorflow-loss not decreasing when training
https://stackoverflow.com/questions/47315101,47315101,Binary classification always outputs 1
https://stackoverflow.com/questions/47258359,47258359,Autoencoder using Backpropagation
https://stackoverflow.com/questions/47245866,47245866,Tensorflow - Loss increases to NaN
https://stackoverflow.com/questions/47216529,47216529,very low accuracy in Neural networks using keras and validation accuracy 0.0000e+00
https://stackoverflow.com/questions/47116894,47116894,Keras LSTM Accuracy too high
https://stackoverflow.com/questions/47057361,47057361,How do I mask a loss function in Keras with the TensorFlow backend?
https://stackoverflow.com/questions/47028242,47028242,Multiclassification in Python using keras error
https://stackoverflow.com/questions/46998182,46998182,predict sine with tensorflow is different than with keras
https://stackoverflow.com/questions/46982222,46982222,Keras multiple binary outputs
https://stackoverflow.com/questions/46880887,46880887,Keras sequence prediction with multiple simultaneous sequences
https://stackoverflow.com/questions/46836857,46836857,Results not reproducible with Keras and TensorFlow in Python
https://stackoverflow.com/questions/46775242,46775242,how to solve the conv2d error?
https://stackoverflow.com/questions/46700479,46700479,Can't get simple tensorflow logistic regression program to work with sigmoid activation function.
https://stackoverflow.com/questions/46697007,46697007,Keras binary classification squash output to zero/one
https://stackoverflow.com/questions/46685698,46685698,How to do multi-class image classification in keras?
https://stackoverflow.com/questions/46535855,46535855,Basic Neural Net Predictions?
https://stackoverflow.com/questions/46359741,46359741,Keras giving unexpected output for simple binary classification
https://stackoverflow.com/questions/46240629,46240629,"loss, val_loss, acc and val_acc do not update at all over epochs"
https://stackoverflow.com/questions/46210876,46210876,Use neural network to learn a square wave function
https://stackoverflow.com/questions/46164419,46164419,Tensorflow:assertion failed: [`labels` out of bound]
https://stackoverflow.com/questions/46134434,46134434,Keras Sequential Neural Network
https://stackoverflow.com/questions/46119435,46119435,"Keras LSTM - why different results with ""same"" model & same weights?"
https://stackoverflow.com/questions/46102209,46102209,CNN Overfitting (with output and code)
https://stackoverflow.com/questions/46097200,46097200,Keras input shape
https://stackoverflow.com/questions/46081487,46081487,Multi-modal neural network training loss is not decreasing
https://stackoverflow.com/questions/46040656,46040656,Binary Keras LSTM model does not output binary predictions
https://stackoverflow.com/questions/46038671,46038671,how to prepare image dataset for training model?
https://stackoverflow.com/questions/46034363,46034363,Defining model in Keras
https://stackoverflow.com/questions/46014723,46014723,Keras Extremely High Loss
https://stackoverflow.com/questions/45992831,45992831,Why does my squared loss becomes negative in TensorFlow?
https://stackoverflow.com/questions/45945398,45945398,Keras' `model.fit_generator()` behaves different than `model.fit()`
https://stackoverflow.com/questions/45907431,45907431,Shape mismatch in LSTM in keras
https://stackoverflow.com/questions/45886645,45886645,NaN loss in tensorflow LSTM model
https://stackoverflow.com/questions/45871016,45871016,simple keras nn does not predict well
https://stackoverflow.com/questions/45826089,45826089,Keras NN loss not decreasing
https://stackoverflow.com/questions/45632549,45632549,Why is the accuracy for my Keras model always 0 when training?
https://stackoverflow.com/questions/45608460,45608460,TensorFlow Object Detection API poor results
https://stackoverflow.com/questions/45594805,45594805,Keras: Why isn't model.fit() returning the same values as model.evaluate()?
https://stackoverflow.com/questions/45587378,45587378,How to get predicted values in Keras?
https://stackoverflow.com/questions/45586978,45586978,Keras poor performance (Loss and optimization functions?)
https://stackoverflow.com/questions/45545109,45545109,Keras - Autoencoder accuracy stuck on zero
https://stackoverflow.com/questions/45504710,45504710,dropout with relu activations
https://stackoverflow.com/questions/45473426,45473426,How to increase accuracy of neural networks
https://stackoverflow.com/questions/45442843,45442843,Sigmoid layer in Keras
https://stackoverflow.com/questions/45420318,45420318,Keras multiclass classification probabilities do not sum up to 1
https://stackoverflow.com/questions/45363216,45363216,Test accuracy keeps changing for the same data set
https://stackoverflow.com/questions/45349950,45349950,Why do I get a low accuracy in this neural network (tensorflow)?
https://stackoverflow.com/questions/45278276,45278276,"TensorFlow : lstm dropout implementation, shape problems"
https://stackoverflow.com/questions/45198019,45198019,scaling data in NN gives worse results in time and error
https://stackoverflow.com/questions/45196416,45196416,Function approximation with Neural Network - Loss 0
https://stackoverflow.com/questions/45191767,45191767,Tensorflow - loss not decreasing
https://stackoverflow.com/questions/45190707,45190707,Keras deep learning why validation accuracy stuck in a value every time?
https://stackoverflow.com/questions/45011328,45011328,predict_proba does not output probability
https://stackoverflow.com/questions/44930153,44930153,Keras and Sklearn logreg returning different results
https://stackoverflow.com/questions/44911378,44911378,Getting started with Keras for machine learning
https://stackoverflow.com/questions/44807724,44807724,Running Tensorflow Predictions code twice does *not* result same outcome
https://stackoverflow.com/questions/44785924,44785924,Generating data for training in keras
https://stackoverflow.com/questions/44771114,44771114,Low loss and very very low accuracy
https://stackoverflow.com/questions/44758126,44758126,Handling Binary Input / Output
https://stackoverflow.com/questions/44716415,44716415,Approximating sine function with Neural Network and ReLU
https://stackoverflow.com/questions/44684840,44684840,TensorFlow Object Detection Model demo not working accurately
https://stackoverflow.com/questions/44639940,44639940,Replicate MLPClassifier() of sklearn in keras
https://stackoverflow.com/questions/44627977,44627977,Keras Multi-inputs AttributeError: 'NoneType' object has no attribute 'inbound_nodes'
https://stackoverflow.com/questions/44564634,44564634,keras backend proba to categorical
https://stackoverflow.com/questions/44493395,44493395,Keras: model accuracy drops after reaching 99 percent accuracy and loss 0.01
https://stackoverflow.com/questions/44477443,44477443,Training and validation accuracy suddenly drops in convolutional neural network (CNN)
https://stackoverflow.com/questions/44466157,44466157,"Python, keras, Convolutional autoencoder"
https://stackoverflow.com/questions/44395913,44395913,Keras neural network model accuracy is always zero
https://stackoverflow.com/questions/44385805,44385805,Tensorflow always predict the same output
https://stackoverflow.com/questions/44305760,44305760,sequential model give a different result at every run
https://stackoverflow.com/questions/44258739,44258739,Trained and Loaded Keras Sequential Model is giving different result
https://stackoverflow.com/questions/44220605,44220605,Keras validation loss from model.fit() not expected
https://stackoverflow.com/questions/44151760,44151760,"Received a label value of 1 which is outside the valid range of [0, 1) - Python, Keras"
https://stackoverflow.com/questions/44130892,44130892,In Neural Networks: accuracy improvement after each epoch is GREATER than accuracy improvement after each batch. Why?
https://stackoverflow.com/questions/44003302,44003302,Porting loss function written in Tensorflow to Keras results in AttributeError
https://stackoverflow.com/questions/43951554,43951554,Nan when training model wit RMSE/ RMSLE loss function
https://stackoverflow.com/questions/43881364,43881364,Why can model not even predict sine
https://stackoverflow.com/questions/43776661,43776661,TensorFlow model gets loss 0
https://stackoverflow.com/questions/43750322,43750322,XOR not learned using keras v2.0
https://stackoverflow.com/questions/43720702,43720702,Fitting a sine wave with Keras and PYMC3 yields unexpected results
https://stackoverflow.com/questions/43714594,43714594,tensorflow rnn nan error
https://stackoverflow.com/questions/43690350,43690350,Using Keras to structure LSTM model
https://stackoverflow.com/questions/43636321,43636321,TensorFlow - Training accuracy not improving in MNIST data
https://stackoverflow.com/questions/43567289,43567289,Keras cross entropy loss
https://stackoverflow.com/questions/43561420,43561420,Simple Tensorflow Multilayer Neural Network Not Learning
https://stackoverflow.com/questions/43560208,43560208,Low accuracy classifying colors
https://stackoverflow.com/questions/43476631,43476631,LSTM with keras
https://stackoverflow.com/questions/43405492,43405492,No Accuracy in my tensorflow network
https://stackoverflow.com/questions/43369783,43369783,Tensorflow accuracy issues
https://stackoverflow.com/questions/43347456,43347456,How to improve the neural networks accuracy?
https://stackoverflow.com/questions/43331057,43331057,Python: Issues training and predicting regression on Keras
https://stackoverflow.com/questions/43190607,43190607,Is this an overfitted network?
https://stackoverflow.com/questions/43140591,43140591,Neural Network to predict nth square
https://stackoverflow.com/questions/43083381,43083381,Keras - predict_proba does not add up to 1?
https://stackoverflow.com/questions/43077047,43077047,Possible reasons for overfitting the dataset
https://stackoverflow.com/questions/43025416,43025416,categorical_crossentropy returns small loss value even if accuracy is 1.00 in keras
https://stackoverflow.com/questions/42978947,42978947,Incorrect input to Conv2D in Keras
https://stackoverflow.com/questions/42873166,42873166,Multi-class classification using keras
https://stackoverflow.com/questions/42851216,42851216,Why did the Keras Sequential model give a different result compared to Model model?
https://stackoverflow.com/questions/42822486,42822486,Keras model fit_generator odd error
https://stackoverflow.com/questions/42790561,42790561,LSTM's for Binary classification in Keras?
https://stackoverflow.com/questions/42681757,42681757,Tensorflow LSTM Gate weights
https://stackoverflow.com/questions/42652526,42652526,Is this the right way to predict a time series with the stateful LSTM neural network?
https://stackoverflow.com/questions/42532386,42532386,How to work with multiple inputs for LSTM in Keras?
https://stackoverflow.com/questions/42524009,42524009,Machine Learning (Adversarial Images)
https://stackoverflow.com/questions/42453546,42453546,Keras model gets constant loss and accuracy
https://stackoverflow.com/questions/42447036,42447036,Overfitting my model over my training data of a single sample
https://stackoverflow.com/questions/42334674,42334674,How to train CNN with an RGB Image
https://stackoverflow.com/questions/42293600,42293600,Accuracy/Loss doesn't change
https://stackoverflow.com/questions/42158866,42158866,Neural network for multi label classification with large number of classes outputs only zero
https://stackoverflow.com/questions/42128605,42128605,Keras classifier predict_proba() doesn't match predict()
https://stackoverflow.com/questions/41977498,41977498,RNN is not overfitting on simple data
https://stackoverflow.com/questions/41946894,41946894,Keras dimension mismatch with ImageDataGenerator
https://stackoverflow.com/questions/41893565,41893565,How to fix my accuracy function in `tensorflow`?
https://stackoverflow.com/questions/41819457,41819457,Zero accuracy training a neural network in Keras
https://stackoverflow.com/questions/41716380,41716380,"Keras, output of model predict_proba"
https://stackoverflow.com/questions/41711190,41711190,"Keras, How to get the output of each layer?"
