url,id,title
https://stackoverflow.com/questions/41568239,41568239,Issue with Python Neural Network Code (Keras)
https://stackoverflow.com/questions/41334173,41334173,Trained keras model much slower making its predictions than in training
https://stackoverflow.com/questions/41269518,41269518,Why is my model twice as fast in Tensorflow than in Keras?
https://stackoverflow.com/questions/41195788,41195788,Why Validation Error Rate remain same value?
https://stackoverflow.com/questions/40984940,40984940,Deep Network Produce zero Accuracy
https://stackoverflow.com/questions/40879793,40879793,Tensorflow convert predicted values to binary
https://stackoverflow.com/questions/40790009,40790009,Tensorflow generate random values unexpected behaviour
https://stackoverflow.com/questions/40556580,40556580,Extremely basic neural network not learning
https://stackoverflow.com/questions/40459022,40459022,Neural Network in TensorFlow works worse than Random Forest and predict the same label each time
https://stackoverflow.com/questions/40435078,40435078,tensorflow prediction contains all zeros
https://stackoverflow.com/questions/40404468,40404468,Train model to predict simple linear function
https://stackoverflow.com/questions/40369951,40369951,The model from Keras give me same output
https://stackoverflow.com/questions/40355288,40355288,One dimensional data with CNN
https://stackoverflow.com/questions/40158633,40158633,How to solve nan loss?
https://stackoverflow.com/questions/40045159,40045159,Accuracy not high enough for dogs_cats classification dataset using CNN with Keras-Tf python
https://stackoverflow.com/questions/40029904,40029904,Understanding why tensorflow RNN is not learning toy data
https://stackoverflow.com/questions/39976718,39976718,Deep autoencoder in Keras converting one dimension to another i
https://stackoverflow.com/questions/39681046,39681046,Keras - stateful vs stateless LSTMs
https://stackoverflow.com/questions/39677062,39677062,Why is my very simple neural network not doing at all well?
https://stackoverflow.com/questions/39525358,39525358,Neural network accuracy optimization
https://stackoverflow.com/questions/39489197,39489197,Text Classification for multiple label
https://stackoverflow.com/questions/39309388,39309388,Keras RNN loss does not decrease over epoch
https://stackoverflow.com/questions/39250828,39250828,Multi-Label Classifier in Tensorflow
https://stackoverflow.com/questions/39236601,39236601,How to deal with situation where LSTM fails to learn (constantly makes the same incorrect prediction)
https://stackoverflow.com/questions/39232176,39232176,"Is my model underfitting, tensorflow?"
https://stackoverflow.com/questions/39160772,39160772,Keras convolutional neural network validation accuracy not changing
https://stackoverflow.com/questions/39030672,39030672,Keras ImageDataGenerator not working as expected
https://stackoverflow.com/questions/39013366,39013366,Approximating a simple sin() function with lasagne
https://stackoverflow.com/questions/38876765,38876765,How to deal with overfitting in Tensorflow?
https://stackoverflow.com/questions/38787714,38787714,Keras deep variational autoencoder
https://stackoverflow.com/questions/38561182,38561182,Neural network XOR gate not learning
https://stackoverflow.com/questions/38469632,38469632,TensorFlow: Non-repeatable results
https://stackoverflow.com/questions/37634110,37634110,Approximating non-linear function with NN using Theano
https://stackoverflow.com/questions/37624102,37624102,Very basic Keras CNN with 2 classes giving inexplicable answers
https://stackoverflow.com/questions/37613579,37613579,Convolution Neural Network for image detection/classification
https://stackoverflow.com/questions/37244191,37244191,Model not learning in tensorflow
https://stackoverflow.com/questions/37044600,37044600,Sudden drop in accuracy while training a deep neural net
https://stackoverflow.com/questions/36471758,36471758,Simple regression with Keras seems not working properly
https://stackoverflow.com/questions/36127436,36127436,Tensorflow predicts always the same result
https://stackoverflow.com/questions/35845448,35845448,Simple XOR example on theano
https://stackoverflow.com/questions/35599328,35599328,Keras - unable to reduce loss between epochs
https://stackoverflow.com/questions/35400065,35400065,Multilabel Text Classification using TensorFlow
https://stackoverflow.com/questions/34228138,34228138,Doesn't work example with Keras framework
https://stackoverflow.com/questions/33949968,33949968,Tensorflow multi-class ML model issues
https://stackoverflow.com/questions/33747596,33747596,Problems implementing an XOR gate with Neural Nets in Tensorflow
https://stackoverflow.com/questions/32771786,32771786,Predictions using a Keras Recurrent Neural Network - accuracy is always 1.0
https://stackoverflow.com/questions/31556268,31556268,How to use keras for XOR
https://stackoverflow.com/questions/27699458,27699458,Matlab - ECG Signal
https://stackoverflow.com/questions/24967484,24967484,Neural Network sigmoid function
https://stackoverflow.com/questions/16132627,16132627,Finding the function approximated by a neural network
https://stackoverflow.com/questions/13897316,13897316,Approximating the sine function with a neural network
https://stackoverflow.com/questions/6542274,6542274,How to train an artificial neural network to play Diablo 2 using visual input?
https://stackoverflow.com/questions/4387878,4387878,simulator of realistic ECG signal from rr data for matlab or python
https://stackoverflow.com/questions/1565115,1565115,Unable to approximate the sine function using a neural network
https://stackoverflow.com/questions/1205449,1205449,Neural net input/output
